[
  {
    "id": 1061953414,
    "name": "skills",
    "original_url": "https://github.com/anthropics/skills",
    "canonical_url": "https://github.com/anthropics/skills",
    "aliases": [],
    "fork_url": null,
    "fork_status": "pending",
    "fork_error": "No matching public fork found. Authenticated account-wide fork scan and creation unavailable in this session.",
    "description": null,
    "upstream_description": "Public repository for Agent Skills",
    "category": "ai-skills-mcp",
    "tags": [],
    "upstream_topics": [
      "agent-skills"
    ],
    "license": null,
    "license_url": null,
    "language": "Python",
    "technologies": [
      "Python"
    ],
    "compatible_ai_tools": [
      "Claude"
    ],
    "use_cases": [
      "Reuse task-specific agent instructions"
    ],
    "installation_requirements": [],
    "notes": "README states mixed licensing: many examples Apache-2.0; document skills source-available. Inspect each skill license.",
    "status": "active",
    "fork_outcome": null,
    "date_added": "2026-10-16T01:50:32+00:00",
    "last_verified": "2026-10-16T01:50:32+00:00",
    "last_attempted": "2026-10-16T01:50:32+00:00",
    "readme_url": "https://github.com/anthropics/skills/blob/main/README.md",
    "documentation_url": null,
    "classification_status": "reviewed",
    "readme_excerpt": null,
    "readme_error": null,
    "metadata_error": null,
    "upstream_pushed_at": "2026-10-09T18:45:52Z",
    "upstream_changed": false,
    "previous_names": [],
    "classification_evidence": "Owner-provided initial grouping, checked against upstream description and README."
  },
  {
    "id": 890668799,
    "name": "servers",
    "original_url": "https://github.com/modelcontextprotocol/servers",
    "canonical_url": "https://github.com/modelcontextprotocol/servers",
    "aliases": [],
    "fork_url": null,
    "fork_status": "pending",
    "fork_error": "No matching public fork found. Authenticated account-wide fork scan and creation unavailable in this session.",
    "description": null,
    "upstream_description": "Model Context Protocol Servers",
    "category": "ai-skills-mcp",
    "tags": [],
    "upstream_topics": [],
    "license": "NOASSERTION",
    "license_url": null,
    "language": "JavaScript",
    "technologies": [
      "JavaScript"
    ],
    "compatible_ai_tools": [],
    "use_cases": [
      "Study MCP server implementations"
    ],
    "installation_requirements": [],
    "notes": "README describes reference implementations, not production-ready services. Existing code MIT; new contributions Apache-2.0 per README; API reports NOASSERTION.",
    "status": "active",
    "fork_outcome": null,
    "date_added": "2026-10-16T01:50:32+00:00",
    "last_verified": "2026-10-16T01:50:32+00:00",
    "last_attempted": "2026-10-16T01:50:32+00:00",
    "readme_url": "https://github.com/modelcontextprotocol/servers/blob/main/README.md",
    "documentation_url": "https://modelcontextprotocol.io",
    "classification_status": "reviewed",
    "readme_excerpt": null,
    "readme_error": null,
    "metadata_error": null,
    "upstream_pushed_at": "2026-10-13T05:54:47Z",
    "upstream_changed": false,
    "previous_names": [],
    "classification_evidence": "Owner-provided initial grouping, checked against upstream description and README."
  },
  {
    "id": 942771284,
    "name": "github-mcp-server",
    "original_url": "https://github.com/github/github-mcp-server",
    "canonical_url": "https://github.com/github/github-mcp-server",
    "aliases": [],
    "fork_url": null,
    "fork_status": "pending",
    "fork_error": "No matching public fork found. Authenticated account-wide fork scan and creation unavailable in this session.",
    "description": null,
    "upstream_description": "GitHub's official MCP Server",
    "category": "ai-skills-mcp",
    "tags": [],
    "upstream_topics": [
      "github",
      "mcp",
      "mcp-server"
    ],
    "license": "MIT",
    "license_url": "https://api.github.com/licenses/mit",
    "language": "Go",
    "technologies": [
      "Go"
    ],
    "compatible_ai_tools": [
      "MCP clients"
    ],
    "use_cases": [
      "Connect an assistant to GitHub workflows"
    ],
    "installation_requirements": [],
    "notes": "",
    "status": "active",
    "fork_outcome": null,
    "date_added": "2026-10-16T01:50:32+00:00",
    "last_verified": "2026-10-16T01:50:32+00:00",
    "last_attempted": "2026-10-16T01:50:32+00:00",
    "readme_url": "https://github.com/github/github-mcp-server/blob/main/README.md",
    "documentation_url": null,
    "classification_status": "reviewed",
    "readme_excerpt": null,
    "readme_error": null,
    "metadata_error": null,
    "upstream_pushed_at": "2026-10-15T21:16:40Z",
    "upstream_changed": false,
    "previous_names": [],
    "classification_evidence": "Owner-provided initial grouping, checked against upstream description and README."
  },
  {
    "id": 952688112,
    "name": "playwright-mcp",
    "original_url": "https://github.com/microsoft/playwright-mcp",
    "canonical_url": "https://github.com/microsoft/playwright-mcp",
    "aliases": [],
    "fork_url": null,
    "fork_status": "pending",
    "fork_error": "No matching public fork found. Authenticated account-wide fork scan and creation unavailable in this session.",
    "description": null,
    "upstream_description": "Playwright MCP server",
    "category": "ai-skills-mcp",
    "tags": [],
    "upstream_topics": [
      "mcp",
      "playwright"
    ],
    "license": "Apache-2.0",
    "license_url": "https://api.github.com/licenses/apache-2.0",
    "language": "TypeScript",
    "technologies": [
      "TypeScript"
    ],
    "compatible_ai_tools": [
      "VS Code",
      "Cursor",
      "Claude Desktop"
    ],
    "use_cases": [
      "Automate browser tasks through MCP"
    ],
    "installation_requirements": [
      "Node.js 18+",
      "An MCP-compatible client"
    ],
    "notes": "",
    "status": "active",
    "fork_outcome": null,
    "date_added": "2026-10-16T01:50:32+00:00",
    "last_verified": "2026-10-16T01:50:32+00:00",
    "last_attempted": "2026-10-16T01:50:32+00:00",
    "readme_url": "https://github.com/microsoft/playwright-mcp/blob/main/README.md",
    "documentation_url": "https://www.npmjs.com/package/@playwright/mcp",
    "classification_status": "reviewed",
    "readme_excerpt": null,
    "readme_error": null,
    "metadata_error": null,
    "upstream_pushed_at": "2026-10-08T17:51:59Z",
    "upstream_changed": false,
    "previous_names": [],
    "classification_evidence": "Owner-provided initial grouping, checked against upstream description and README."
  },
  {
    "id": 1158722119,
    "name": "agent-skills",
    "original_url": "https://github.com/addyosmani/agent-skills",
    "canonical_url": "https://github.com/addyosmani/agent-skills",
    "aliases": [],
    "fork_url": null,
    "fork_status": "pending",
    "fork_error": "No matching public fork found. Authenticated account-wide fork scan and creation unavailable in this session.",
    "description": null,
    "upstream_description": "Production-grade engineering skills for AI coding agents.",
    "category": "ai-skills-mcp",
    "tags": [],
    "upstream_topics": [
      "agent-skills",
      "antigravity",
      "claude-code",
      "codex",
      "cursor",
      "skills"
    ],
    "license": "MIT",
    "license_url": "https://api.github.com/licenses/mit",
    "language": "JavaScript",
    "technologies": [
      "JavaScript"
    ],
    "compatible_ai_tools": [
      "Claude Code"
    ],
    "use_cases": [
      "Apply repeatable coding-agent workflows"
    ],
    "installation_requirements": [],
    "notes": "",
    "status": "active",
    "fork_outcome": null,
    "date_added": "2026-10-16T01:50:32+00:00",
    "last_verified": "2026-10-16T01:50:32+00:00",
    "last_attempted": "2026-10-16T01:50:32+00:00",
    "readme_url": "https://github.com/addyosmani/agent-skills/blob/main/README.md",
    "documentation_url": "https://skills.addy.ie",
    "classification_status": "reviewed",
    "readme_excerpt": null,
    "readme_error": null,
    "metadata_error": null,
    "upstream_pushed_at": "2026-10-13T20:24:07Z",
    "upstream_changed": false,
    "previous_names": [],
    "classification_evidence": "Owner-provided initial grouping, checked against upstream description and README."
  },
  {
    "id": 1266797999,
    "name": "ponytail",
    "original_url": "https://github.com/DietrichGebert/ponytail",
    "canonical_url": "https://github.com/DietrichGebert/ponytail",
    "aliases": [],
    "fork_url": null,
    "fork_status": "pending",
    "fork_error": "No matching public fork found. Authenticated account-wide fork scan and creation unavailable in this session.",
    "description": null,
    "upstream_description": "Makes your AI agent think like the laziest senior dev in the room. The best code is the code you never wrote.",
    "category": "ai-skills-mcp",
    "tags": [],
    "upstream_topics": [
      "agent-skills",
      "ai-agents",
      "claude",
      "claude-code",
      "claude-code-plugin",
      "cursor-rules",
      "developer-tools",
      "llm",
      "prompt-engineering",
      "yagni"
    ],
    "license": "MIT",
    "license_url": "https://api.github.com/licenses/mit",
    "language": "JavaScript",
    "technologies": [
      "JavaScript"
    ],
    "compatible_ai_tools": [],
    "use_cases": [
      "Guide agents toward simpler implementations"
    ],
    "installation_requirements": [],
    "notes": "",
    "status": "active",
    "fork_outcome": null,
    "date_added": "2026-10-16T01:50:32+00:00",
    "last_verified": "2026-10-16T01:50:32+00:00",
    "last_attempted": "2026-10-16T01:50:32+00:00",
    "readme_url": "https://github.com/DietrichGebert/ponytail/blob/main/README.md",
    "documentation_url": "https://ponytail.dev",
    "classification_status": "reviewed",
    "readme_excerpt": null,
    "readme_error": null,